{
  "release_date": "2026-10-07",
  "generated_at": "2026-10-16T22:45:26+00:00",
  "methodology_version": "0.7.3-draft",
  "commit_sha": "d936c61",
  "counters": {
    "resources_processed": 24761939,
    "npis_checked": 9526462,
    "npis_flagged": 0,
    "endpoints_live_pct": 85.37,
    "findings_published": 24,
    "findings_in_progress": 1,
    "findings_pre_registered": 14
  },
  "counters_as_of": {
    "endpoints_live_pct": "2026-04-09"
  }
}
